source_section,example_name,normalized_name,source_formula,compact_notation,add_count,operator_tokens,movement_class,spin_direction,turn_magnitude_implied,notes
"3 adds",Inspinning Same Side Illusion,inspinning-same-side-illusion,"CLIP > (front) SPIN [BOD] > OP OUT [DEX] > OP TOE [DEL] OR TOE > (front) SPIN [BOD] > SAME OUT [DEX] > OP TOE [DEL]",,3,"clip;toe;front;spin;bod;op;same;out;dex;op;toe;del",front-spin-illusion,front (inspinning),not-specified,"Source provides TWO operational variants; 'Same Side' refers to TOE-start variant where dex is on SAME leg as the spin"
"3 adds",Inspinning Same Side Mirage,inspinning-same-side-mirage,"CLIP > (front) SPIN [BOD] > OP IN [DEX] > OP TOE [DEL] OR TOE > (front) SPIN [BOD] > SAME IN [DEX] > OP TOE [DEL]",,3,"clip;toe;front;spin;bod;op;same;in;dex;op;toe;del",front-spin-mirage,front (inspinning),not-specified,"Source provides TWO operational variants"
"4 adds",Gyro Butterfly,gyro-butterfly,"CLIP > (back) SPIN [BOD] > SAME OUT [DEX] > OP CLIP [XBD] [DEL] OR TOE > (back) SPIN [BOD] > OP OUT [DEX] > OP CLIP [XBD] [DEL]",,4,"clip;toe;back;spin;bod;same;op;out;dex;op;clip;xbd;del",back-spin-butterfly,back (gyro/spinning),not-specified,"Source uses (back) SPIN — identical operational token as ''Spinning'' compounds in paradoxMoves.txt"
"4 adds","Vortex (Gyro Drifter)",vortex,"CLIP > (back) SPIN [BOD] > SAME IN [DEX] > SAME CLIP [XBD] [DEL] OR TOE > (back) SPIN [BOD] > OP IN [DEX] > SAME CLIP [XBD] [DEL]",gyro drifter,4,"clip;toe;back;spin;bod;same;op;in;dex;same;clip;xbd;del",back-spin-drifter,back (gyro),not-specified,"Source: 'let the bag pass behind your back and without putting the right leg down turn to the right'. paradox-tutorial.txt explicitly identifies vortex as 'gyrating drifter' (NON-paradox); this source confirms"
"4 adds",Inspinning Same Side Butterfly,inspinning-same-side-butterfly,"CLIP > (front) SPIN [BOD] > OP OUT [DEX] > OP CLIP [XBD] [DEL] OR TOE > (front) SPIN [BOD] > SAME OUT [DEX] > OP CLIP [XBD] [DEL]",,4,"clip;toe;front;spin;bod;op;same;out;dex;op;clip;xbd;del",front-spin-butterfly,front (inspinning),not-specified,"Source provides TWO operational variants"
"5 adds","Spyro Gyro (Gyro Butterfly Swirl)",spyro-gyro,CLIP > (BACK) SPIN [BOD] > SAME OUT [DEX] > OP BACK SWIRL [DEX] > SAME CLIP [XBD] [DEL],gyro butterfly swirl,5,"clip;back;spin;bod;same;out;dex;op;back;swirl;same;clip;xbd;del",back-spin-butterfly-swirl,back (gyro),not-specified,"Source uses (BACK) uppercase. Modern chain registry has spyro-gyro → 'gyro butterfly swirl' (curatorConfirmPending: true). NOT in canonical DB"
"5 adds","Flurricane (Gyro Flurry)",flurricane,"CLIP > (back) SPIN [BOD] > SAME IN [DEX] > SAME IN [DEX] > OP OUT [DEX] > SAME TOE [DEL] OR TOE > (back) SPIN [BOD] > OP IN [DEX] > SAME IN [DEX] > OP OUT [DEX] > SAME TOE [DEL]",gyro flurry,5,"clip;toe;back;spin;bod;same;op;in;out;dex;same;toe;del",back-spin-flurry,back (gyro),not-specified,"Folk-named compound. 3-dex chain (flurry shape) after back-spin. NOT in canonical DB"
"5 adds","Mobius (Gyro Torque)",mobius,CLIP > (BACK) SPIN [BOD] > SAME IN [DEX] > (BACK) SPIN [BOD] > OP CLIP [XBD] [DEL],gyro torque,5,"clip;back;spin;bod;same;in;dex;op;clip;xbd;del",back-spin-mirage-back-spin,back (gyro) TWICE,implies-double-spin-or-gyro-half-plus-spin-full,"Source operational has TWO (BACK) SPIN tokens. Chain reading 'gyro torque' confirms gyro. Modern DB chain has THREE readings: 'gyro torque' / 'spinning ss torque' / 'spinning ss miraging op osis' — gyro AND spinning conflated for same trick"
"6 adds","Big Apple (Gyro Symposium Torque)",big-apple,CLIP > (back) SPIN [BOD] > (no plant while) SAME IN [BOD] [DEX] > (back) SPIN [BOD] > OP CLIP [XBD] [DEL],gyro symposium torque,6,"clip;back;spin;bod;no-plant;same;in;dex;op;clip;xbd;del",back-spin-symposium-back-spin,back (gyro) TWICE,same-as-mobius-but-with-symposium-injected,"Source has TWO (back) SPIN tokens surrounding a no-plant in-dex. Chain reading 'gyro symposium torque' Red-confirmed"
