club_key,name,force_category,reason
austin,Austin Style Footbag Club - Texas Footbag League,pre_populate,Established active club; lock as pre_populate against rule drift.
kits,Kitsilano Footbag Association,pre_populate,Established active club; lock as pre_populate against rule drift.
1721169686,Cortes Island Footbag Club,pre_populate,New active club under curator review; rescues the R3-conjunction demotion.
1728989660,Net Break Crew,pre_populate,New active club under curator review; rescues the R3-conjunction demotion.
1751979051,Caracas Footbag Club,pre_populate,New active club under curator review; rescues the R3-conjunction demotion.
1768623634,North Bay Flyers,pre_populate,New active club under curator review; rescues the R3-conjunction demotion.
