alias_text,target_canonical_slug,alias_type,alias_display,note
Nuclear DLO,nuclear_double_leg_over,technical,0,DLO abbreviation of double leg over
Quantum DLO,quantum_double_leg_over,technical,0,DLO abbreviation of double leg over
Spinning DLO,spinning_double_leg_over,technical,0,DLO abbreviation of double leg over
Tapping DLO,tapping_double_leg_over,technical,0,DLO abbreviation of double leg over
Sailing DLO,sailing_double_leg_over,technical,0,DLO abbreviation of double leg over
Ducking DLO,ducking_double_leg_over,technical,0,DLO abbreviation of double leg over
Fairy Ducking DLO,fairy_ducking_double_leg_over,technical,0,DLO abbreviation of double leg over
Fairy Gyro DLO,fairy_gyro_double_leg_over,technical,0,DLO abbreviation of double leg over
Pixie Gyro DLO,pixie_gyro_double_leg_over,technical,0,DLO abbreviation of double leg over
Gyro Symposium DLO,gyro_symposium_double_leg_over,technical,0,DLO abbreviation of double leg over
Stepping Diving DLO,stepping_diving_double_leg_over,technical,0,DLO abbreviation of double leg over
Stepping Ducking DLO,stepping_ducking_double_leg_over,technical,0,DLO abbreviation of double leg over
Fairy DOD,fairy_double_over_down,technical,0,DOD abbreviation of double over down
Pixie DOD,pixie_double_over_down,technical,0,DOD abbreviation of double over down
DOD Swirl,double_over_down_swirl,technical,0,DOD abbreviation of double over down
Diving DDD,down_diver,technical,0,DDD abbreviation; named canonical down diver
Shooting DDD,shooting_star,technical,0,DDD abbreviation; named canonical shooting star
Furious DLO,nebula,technical,0,DLO abbreviation; named canonical nebula
Symposium Hatchet,diving_symposium_whirl,structural,0,structural decomposition symposium + hatchet (diving whirl) = diving symposium whirl
Amadeus,gyro_dada_curve,historical,0,folk nickname for gyro dada curve
Cyclone,shooting_gyro_mirage,historical,0,folk nickname for shooting gyro mirage
Egg Plant,eggbeater,historical,0,folk nickname for eggbeater
King Kong,tapping_whirling_swirl,historical,0,folk nickname for tapping whirling swirl
Zig Zag,swirling_reverse_swirl,historical,0,folk nickname for swirling reverse swirl
Croissant,pixie_symposium_whirling_swirl,historical,0,folk nickname for pixie symposium whirling swirl
Fromage,fairy_gyro_barrage,historical,0,folk nickname for fairy gyro barrage
Triptide,quantum_butterfly_swirl,historical,0,folk nickname for quantum butterfly swirl
Blacula,blackula,historical,0,folk spelling variant of blackula
Down River,down_diver,historical,0,folk nickname for down diver
Entree,terraging_mirage,historical,0,folk nickname for terraging mirage
Red Giant,gyro_diving_symposium_torque,historical,0,folk nickname for gyro diving symposium torque
Phoenix Swirl,pixie_ducking_butterfly_swirl,historical,0,folk nickname for pixie ducking butterfly swirl
Pixie Armageddon,pixie_miraging_symposium_eggbeater,historical,0,folk nickname for pixie miraging symposium eggbeater
Backside Torus,fairy_gyro_symposium_mirage,historical,0,folk nickname for fairy gyro symposium mirage
Gilan,pixie_gyro_double_leg_over,historical,0,folk nickname for pixie gyro double leg over
Wentletrap,fairy_gyro_double_leg_over,historical,0,folk nickname for fairy gyro double leg over
Wauxpin,butterfly_gyro_toe,historical,0,folk nickname for butterfly gyro toe
Arachnophobia,stepping_diving_double_leg_over,historical,0,folk nickname for stepping diving double leg over
Alpine Fume,fairy_ducking_drifter,historical,0,folk nickname for fairy ducking drifter
Alpine Maverick,pixie_diving_osis,historical,0,folk nickname for pixie diving osis
Alpine Tap,tapping_diving_mirage,historical,0,folk nickname for tapping diving mirage
Dimwalk Swirl,pixie_butterfly_swirl,historical,0,folk nickname for pixie butterfly swirl
Clipper Set Illusion,bubba,common,0,"footbag.org move 262: Clipper Set Illusion is Bubba's canonical move name (Bubba is the nickname); opposite-toe illusion receiver, CLIP > OP OUT [DEX] > OP TOE [DEL]"
Scorpion's Tail,scorpions_tail,common,0,record spelling with an apostrophe (slugifies to scorpion_s_tail) so the Scorpion's Tail world-record resolves to the scorpions_tail trick
Clipper far Double Down,down_double_down,technical,0,down-family cell label: clipper set with other-leg dexes is the Down Double-Down cell (ratified four-cell grid; curator session 2026-07-14)
Clipper near Double Down,barfly,technical,0,down-family cell label: clipper set with setting-leg dexes is the Barfly cell (ratified four-cell grid; curator session 2026-07-14)
Toe far Double Down,paradon,technical,0,down-family cell label: toe set with other-leg dexes is the Paradon cell (ratified four-cell grid; curator session 2026-07-14)
Toe near Double Down,double_over_down,technical,0,down-family cell label: toe set with setting-leg dexes is the Double-Over Down cell (ratified four-cell grid; curator session 2026-07-14)
Toe set os Double Over Down,paradon,technical,0,down-family cell label: the os marker flips the toe-set Double-Over Down name to the other-leg Paradon cell (curator session 2026-07-14)
Clipper set ss Double Over Down,barfly,technical,0,down-family cell label: the clipper set with setting-leg dexes is the Barfly cell (curator session 2026-07-14)
Nuclear ss Reverse Guay,nuclear_rev_guay,technical,0,distributive same-side reading restates the plain form verbatim (both dexes already same-side); catch-targeted reading recorded as superseded (curator session 2026-07-14)
Toe near Symp. Double Down,symposium_double_over_down,technical,0,down-family cell label: toe set with setting-leg dexes under a symposium lead is the live symposium double over down (curator session 2026-07-14)
Toe far Symp. Double Down,symposium_paradon,technical,0,down-family cell label: toe set with other-leg dexes under a symposium lead is the live symposium paradon (curator session 2026-07-14)
Clipper far Symp. Double Down,shaft,technical,0,down-family cell label: clipper set with other-leg dexes under a symposium lead is the live shaft (symposium down double down) (curator session 2026-07-14)
Clipper near Symp. Double Down,superfly,technical,0,down-family cell label: clipper set with setting-leg dexes under a symposium lead is the live superfly (symposium barfly) (curator session 2026-07-14)
BS Paste,backside_paste,technical,0,BS abbreviates Backside and backside paste is the active canonical
Xbd Sole Stall,cross_body_sole_stall,technical,0,Xbd abbreviates cross-body and cross-body sole stall is the active canonical
Gryo DLO,gyro_double_leg_over,technical,0,Gryo is a source typo for Gyro and DLO is double leg over; resolves to the active gyro double leg over
double-dex ATW,double_around_the_world,technical,0,a double-dex Around the World is two repeated inward dexes matching the canonical double around the world
triple-dex ATW,triple_around_the_world,technical,0,a triple-dex Around the World is three repeated inward dexes matching the canonical triple around the world
Double Reverse ATW,double_orbit,technical,0,Reverse Around the World is the outward Orbit counterpart by ratified direction doctrine and the double form is the canonical double orbit
Triple Reverse ATW,triple_orbit,technical,0,Reverse Around the World is the outward Orbit counterpart by ratified direction doctrine and the triple form is the canonical triple orbit
Rasmus,atomic_ducking_mirage,technical,0,folk name; source structure (toe op-out dex > duck bod > op-in dex > op-toe del) matches atomic ducking mirage exactly; source 5-ADD X-Dex reading kept as provenance vs the canonical 4
Leaning Jowler,surging_mirage,technical,0,folk name; source structure (clip op-in dex > front-spin bod > same-in dex > op-toe del) matches surging mirage exactly
Grifter (same side),reverse_drifter,technical,0,same-side grifter; source structure (clip op-out dex > same-clip xbd del) matches reverse drifter exactly including the same-side terminal
Omelette,atomic_illusion,common,1,Folk name for atomic illusion; identical formula (TOE > OP OUT [DEX] > OP OUT [DEX] > OP TOE [DEL]). Historically classified base_trick=pickup per Red pt6 (Omelette = Illusioning Pickup); superseded because illusioning is no longer a scored operator and the pickup identity contradicts the illusion terminal. Folded from a retired parallel canonical row.
Revup,reverse_swirling_pickup,common,1,Folk name; footbag.org expands Revup as Reverse Swirling Pickup. Folded from a retired duplicate canonical row so the single surviving reverse swirling pickup row carries the name.
Rev Up,reverse_swirling_pickup,common,0,Spelling variant of Revup (also covers Rev-Up); resolves to the surviving reverse swirling pickup.
